{
  "cursor": "initial_cursor_a1b2c3d4",
  "generated_at": "2026-06-29T12:00:00Z",
  "tracks": [
    {
      "id": "track_001",
      "title": "Neon Lights",
      "artist": "Luna Swift",
      "album": "Imaginary Cities",
      "duration_ms": 245300,
      "track_number": 1,
      "disc_number": 1,
      "year": 2025,
      "genre": "Electronic",
      "format": "flac",
      "size_bytes": 42345678,
      "md5_hash": "a1b2c3d4e5f6a7b8c9d0e1f2a3b4c5d6",
      "artwork_id": "artwork_001",
      "modified_at": "2026-06-28T10:00:00Z"
    },
    {
      "id": "track_002",
      "title": "Echoes in the Rain",
      "artist": "The Echoes",
      "album": "Neon Dreams",
      "duration_ms": 312800,
      "track_number": 3,
      "disc_number": 1,
      "year": 2024,
      "genre": "Indie",
      "format": "flac",
      "size_bytes": 52345678,
      "md5_hash": "b2c3d4e5f6a7b8c9d0e1f2a3b4c5d6e7",
      "artwork_id": "artwork_002",
      "modified_at": "2026-06-27T14:30:00Z"
    },
    {
      "id": "track_003",
      "title": "Pulse Wave",
      "artist": "Neon Pulse",
      "album": "Neon Dreams",
      "duration_ms": 198100,
      "track_number": 5,
      "disc_number": 1,
      "year": 2024,
      "genre": "Synthwave",
      "format": "mp3",
      "size_bytes": 8234567,
      "md5_hash": "c3d4e5f6a7b8c9d0e1f2a3b4c5d6e7f8",
      "artwork_id": "artwork_003",
      "modified_at": "2026-06-26T09:15:00Z"
    }
  ],
  "artworks": [
    {
      "id": "artwork_001",
      "md5": "f1e2d3c4b5a69788796a5b4c3d2e1f00"
    },
    {
      "id": "artwork_002",
      "md5": "a2b3c4d5e6f7890123456789abcdef01"
    }
  ]
}
